{
    "store": "Costco",
    "items": [
        {
            "description": "KIRKLAND BATTERIES",
            "price": 14.99
        },
        {
            "description": "ROTISSERIE CHICKEN",
            "price": 4.99
        },
        {
            "description": "KIRKLAND WATER 40PK",
            "price": 3.79
        }
    ],
    "subtotal": 23.77,
    "tax": 1.20,
    "total": 24.97,
    "payment_method": "VISA",
    "timestamp": "2024-04-15T10:45:00",
    "check_items_exactly": true
}